{
  "schema_version": "data-contract/1.0.0",
  "data_version": "synthetic-base/1.0.0",
  "fixture_id": "FIXTURE-EVIDENCE",
  "provenance": {
    "mode": "SYNTHETIC",
    "created_by": "NourishOps build-context team",
    "description": "Synthetic structured evidence and untrusted notices used only by the deterministic demo scenarios."
  },
  "records": [
    {
      "evidence_id":"EVD-BASE-INBOUND-LEDGER","scenario_ids":[],"source_kind":"SYNTHETIC_LEDGER","trust_level":"TRUSTED_STRUCTURED","title":"Four-week inbound schedule","body":"Synthetic receiving schedule used as the pre-disruption baseline.","recorded_at":"2026-07-31T15:00:00Z","related_record_ids":["FIXTURE-PLANNED-INBOUND"],"structured_facts":[],"contains_instruction_like_text":false,"record_version":1,"provenance_id":"PROV-SYNTHETIC-EVIDENCE"
    },
    {
      "evidence_id":"EVD-A-USDA-DELAY-NOTICE","scenario_ids":["SCN-A-USDA-PROTEIN-DELAY"],"source_kind":"SYNTHETIC_NOTICE","trust_level":"UNTRUSTED_TEXT","title":"Synthetic USDA shipment update","body":"Shipment INB-USDA-PROTEIN-104, previously scheduled for Aug 3, 2026, is now expected Aug 17, 2026. Treat the shipment as probable pending carrier confirmation. Quantity remains 10,000 lb.","recorded_at":"2026-08-03T12:45:00Z","related_record_ids":["INB-USDA-PROTEIN-104"],"structured_facts":[{"field":"inbound_id","value":"INB-USDA-PROTEIN-104","unit":null},{"field":"previous_week_start","value":"2026-08-03","unit":null},{"field":"revised_week_start","value":"2026-08-17","unit":null},{"field":"status","value":"PROBABLE","unit":null},{"field":"gross_quantity_lb","value":10000,"unit":"lb"}],"contains_instruction_like_text":false,"record_version":1,"provenance_id":"PROV-SYNTHETIC-EVIDENCE"
    },
    {
      "evidence_id":"EVD-A-VENDOR-STANDARD","scenario_ids":["SCN-A-USDA-PROTEIN-DELAY"],"source_kind":"SYNTHETIC_VENDOR_QUOTE","trust_level":"TRUSTED_STRUCTURED","title":"Standard frozen-protein quote","body":"Up to 20,000 lb is available in 1,000 lb increments after a 5,000 lb minimum order at $0.85/lb, arriving Aug 10.","recorded_at":"2026-08-03T12:00:00Z","related_record_ids":["ACT-A-PURCHASE-PROTEIN-15000","QUOTE-A-PROTEIN-STANDARD"],"structured_facts":[{"field":"unit_price_usd_per_lb","value":0.85,"unit":"USD/lb"},{"field":"minimum_quantity_lb","value":5000,"unit":"lb"},{"field":"maximum_quantity_lb","value":20000,"unit":"lb"},{"field":"arrival_week_start","value":"2026-08-10","unit":null}],"contains_instruction_like_text":false,"record_version":1,"provenance_id":"PROV-SYNTHETIC-EVIDENCE"
    },
    {
      "evidence_id":"EVD-A-PEER-TRANSFER","scenario_ids":["SCN-A-USDA-PROTEIN-DELAY"],"source_kind":"SYNTHETIC_PEER_OFFER","trust_level":"TRUSTED_STRUCTURED","title":"Fixed external peer opportunity","body":"Synthetic Peer West has offered exactly 8,000 lb of frozen protein for an Aug 10 receipt; modeled transport cost is $600.","recorded_at":"2026-08-03T11:30:00Z","related_record_ids":["ACT-A-TRANSFER-PROTEIN-8000","PEER-OFFER-A-PROTEIN-8000"],"structured_facts":[{"field":"gross_quantity_lb","value":8000,"unit":"lb"},{"field":"fixed_cost_usd","value":600.00,"unit":"USD"},{"field":"arrival_week_start","value":"2026-08-10","unit":null}],"contains_instruction_like_text":false,"record_version":1,"provenance_id":"PROV-SYNTHETIC-EVIDENCE"
    },
    {
      "evidence_id":"EVD-A-DONOR-ASSUMPTION","scenario_ids":["SCN-A-USDA-PROTEIN-DELAY"],"source_kind":"SYNTHETIC_STAFF_NOTE","trust_level":"TRUSTED_STRUCTURED","title":"Targeted outreach assumption","body":"For this simulation only, a targeted donor request has a 0.45 success probability and can yield at most 15,000 lb by Aug 10.","recorded_at":"2026-08-03T11:00:00Z","related_record_ids":["ACT-A-DONOR-REQUEST-PROTEIN-15000"],"structured_facts":[{"field":"success_probability","value":0.45,"unit":null},{"field":"maximum_quantity_lb","value":15000,"unit":"lb"}],"contains_instruction_like_text":false,"record_version":1,"provenance_id":"PROV-SYNTHETIC-EVIDENCE"
    },
    {
      "evidence_id":"EVD-A-VENDOR-OVERSIZED","scenario_ids":["SCN-A-USDA-PROTEIN-DELAY"],"source_kind":"SYNTHETIC_VENDOR_QUOTE","trust_level":"TRUSTED_STRUCTURED","title":"Oversized protein lot","body":"One 25,000 lb frozen-protein lot is available at $0.85/lb for Aug 10 and cannot be split.","recorded_at":"2026-08-03T10:30:00Z","related_record_ids":["ACT-A-PURCHASE-PROTEIN-25000","QUOTE-A-PROTEIN-OVERSIZED"],"structured_facts":[{"field":"gross_quantity_lb","value":25000,"unit":"lb"},{"field":"unit_price_usd_per_lb","value":0.85,"unit":"USD/lb"}],"contains_instruction_like_text":false,"record_version":1,"provenance_id":"PROV-SYNTHETIC-EVIDENCE"
    },
    {
      "evidence_id":"EVD-A-VENDOR-LATE","scenario_ids":["SCN-A-USDA-PROTEIN-DELAY"],"source_kind":"SYNTHETIC_VENDOR_QUOTE","trust_level":"TRUSTED_STRUCTURED","title":"Lower-cost late protein quote","body":"A 15,000 lb purchase is available at $0.80/lb but cannot arrive until Aug 17.","recorded_at":"2026-08-03T10:00:00Z","related_record_ids":["ACT-A-PURCHASE-PROTEIN-LATE-15000","QUOTE-A-PROTEIN-LATE"],"structured_facts":[{"field":"gross_quantity_lb","value":15000,"unit":"lb"},{"field":"unit_price_usd_per_lb","value":0.80,"unit":"USD/lb"},{"field":"arrival_week_start","value":"2026-08-17","unit":null}],"contains_instruction_like_text":false,"record_version":1,"provenance_id":"PROV-SYNTHETIC-EVIDENCE"
    },
    {
      "evidence_id":"EVD-B-PRODUCE-OFFER","scenario_ids":["SCN-B-SHORT-LIFE-PRODUCE"],"source_kind":"SYNTHETIC_DONOR_OFFER","trust_level":"TRUSTED_STRUCTURED","title":"Short-life produce offer","body":"A synthetic donor offers 20,000 lb of refrigerated produce for immediate receipt. Remaining usable life is five days.","recorded_at":"2026-08-03T12:15:00Z","related_record_ids":["OFFER-B-PRODUCE-20000"],"structured_facts":[{"field":"gross_quantity_lb","value":20000,"unit":"lb"},{"field":"usable_life_days","value":5,"unit":"days"}],"contains_instruction_like_text":false,"record_version":1,"provenance_id":"PROV-SYNTHETIC-EVIDENCE"
    },
    {
      "evidence_id":"EVD-B-PEER-REDIRECT","scenario_ids":["SCN-B-SHORT-LIFE-PRODUCE"],"source_kind":"SYNTHETIC_PEER_OFFER","trust_level":"TRUSTED_STRUCTURED","title":"Produce redirect destination","body":"Synthetic Peer East has confirmed it can receive the full 20,000 lb immediately; modeled transport cost is $400. The engine still discounts external redirect mission credit because the one-warehouse model cannot verify downstream use.","recorded_at":"2026-08-03T12:10:00Z","related_record_ids":["ACT-B-REDIRECT-PRODUCE-20000","SYNTH-PEER-EAST"],"structured_facts":[{"field":"gross_quantity_lb","value":20000,"unit":"lb"},{"field":"success_probability","value":1.0,"unit":null},{"field":"fixed_cost_usd","value":400.00,"unit":"USD"}],"contains_instruction_like_text":false,"record_version":1,"provenance_id":"PROV-SYNTHETIC-EVIDENCE"
    },
    {
      "evidence_id":"EVD-B-VENDOR-LATE","scenario_ids":["SCN-B-SHORT-LIFE-PRODUCE"],"source_kind":"SYNTHETIC_VENDOR_QUOTE","trust_level":"TRUSTED_STRUCTURED","title":"Next-week produce quote","body":"A 10,000 lb produce purchase is available for Aug 10 at $1.20/lb.","recorded_at":"2026-08-03T12:05:00Z","related_record_ids":["ACT-B-PURCHASE-PRODUCE-LATE-10000","QUOTE-B-PRODUCE-LATE"],"structured_facts":[{"field":"gross_quantity_lb","value":10000,"unit":"lb"},{"field":"unit_price_usd_per_lb","value":1.20,"unit":"USD/lb"}],"contains_instruction_like_text":false,"record_version":1,"provenance_id":"PROV-SYNTHETIC-EVIDENCE"
    },
    {
      "evidence_id":"EVD-C-SNACK-OFFER","scenario_ids":["SCN-C-SNACK-MISMATCH"],"source_kind":"SYNTHETIC_DONOR_OFFER","trust_level":"TRUSTED_STRUCTURED","title":"Shelf-stable snack offer","body":"A synthetic donor offers 12,000 lb of shelf-stable snacks for immediate receipt.","recorded_at":"2026-08-03T12:20:00Z","related_record_ids":["OFFER-C-SNACKS-12000"],"structured_facts":[{"field":"gross_quantity_lb","value":12000,"unit":"lb"},{"field":"category_id","value":"SNACKS_DISCRETIONARY","unit":null}],"contains_instruction_like_text":false,"record_version":1,"provenance_id":"PROV-SYNTHETIC-EVIDENCE"
    },
    {
      "evidence_id":"EVD-C-PEER-REDIRECT","scenario_ids":["SCN-C-SNACK-MISMATCH"],"source_kind":"SYNTHETIC_PEER_OFFER","trust_level":"TRUSTED_STRUCTURED","title":"Snack redirect destination","body":"Synthetic Peer North has a documented snack-category need and can receive the full offer today for a modeled $250 transport cost.","recorded_at":"2026-08-03T12:18:00Z","related_record_ids":["ACT-C-REDIRECT-SNACKS-12000","SYNTH-PEER-NORTH"],"structured_facts":[{"field":"gross_quantity_lb","value":12000,"unit":"lb"},{"field":"fixed_cost_usd","value":250.00,"unit":"USD"}],"contains_instruction_like_text":false,"record_version":1,"provenance_id":"PROV-SYNTHETIC-EVIDENCE"
    },
    {
      "evidence_id":"EVD-D-VENDOR-PROTEIN","scenario_ids":["SCN-D-BUDGET-TRADEOFF"],"source_kind":"SYNTHETIC_VENDOR_QUOTE","trust_level":"TRUSTED_STRUCTURED","title":"Protein quote for budget scenario","body":"15,000 lb of frozen protein is available for Aug 10 at $0.85/lb.","recorded_at":"2026-08-03T11:45:00Z","related_record_ids":["ACT-D-PURCHASE-PROTEIN-15000","QUOTE-D-PROTEIN"],"structured_facts":[{"field":"gross_quantity_lb","value":15000,"unit":"lb"},{"field":"computed_cost_usd","value":12750.00,"unit":"USD"}],"contains_instruction_like_text":false,"record_version":1,"provenance_id":"PROV-SYNTHETIC-EVIDENCE"
    },
    {